{
  "schema_version": 1,
  "task_id": "gh-48-candidate-eval",
  "title": "candidate QA 评估:对 candidate 跑硬规则,产出绑定的 Evaluation",
  "status": "active",
  "branch": "feat/candidate-eval",
  "objective": "对一个 Candidate(+其 source segment 文本)跑确定性硬规则(复用 qa_gate:空译文/失败标记/拒绝/与原文相同/假名残留),产出 schema 合法、绑定 candidate_id 的 Evaluation(verdict + findings),作为 compare/select 的打分基础。",
  "github": {
    "issue": 48,
    "pull_request": null
  },
  "scope": {
    "in": [
      "tasks/translation/src/core/candidate_eval.py(+test)",
      "PROJECT_STATUS/journal"
    ],
    "out": [
      "compare/select/version(#50)",
      "执行器 skill(P2.2)"
    ]
  },
  "context_files": [
    {
      "path": "docs/PROJECT_STATUS.md",
      "purpose": "Current project phase and priorities",
      "required": true
    }
  ],
  "decisions": [],
  "open_questions": [],
  "blockers": [],
  "plan": [
    {
      "id": "S1",
      "title": "evaluate_candidate 硬规则 Evaluation",
      "status": "completed",
      "depends_on": [],
      "acceptance": [
        "复用 qa_gate 规则、findings 对齐、verdict、error_count;确定性;6 测试"
      ]
    },
    {
      "id": "S2",
      "title": "文档 + PR 收尾",
      "status": "in_progress",
      "depends_on": [
        "S1"
      ],
      "acceptance": [
        "PROJECT_STATUS/journal;三渠道 triage;CI 绿;合并"
      ]
    }
  ],
  "next_action": {
    "step_id": "S2",
    "instruction": "开 PR,三渠道 triage,CI 绿后合并。",
    "acceptance": [
      "PR 合并,issue #48 关闭"
    ]
  },
  "validation": {
    "required_commands": [
      "conda run -n llm python -m pytest tasks/translation/src -q"
    ],
    "last_results": [
      {
        "command": "conda run -n llm python -m pytest tasks/translation/src -q",
        "status": "passed",
        "summary": "184 passed(178+6)",
        "timestamp": "2026-06-13T17:52:58Z"
      }
    ]
  },
  "known_unrelated_changes": [],
  "last_checkpoint": {
    "checkpoint_id": "cp-20260613T175258Z-claude-code",
    "timestamp": "2026-06-13T17:52:58Z",
    "agent": "claude-code",
    "summary": "S1 完成,待 PR 收尾",
    "observed_head": "eaec681"
  },
  "next_task": null
}
