{
  "schema_version": 1,
  "task_id": "gh-185-annotate-104039620",
  "title": "Annotate Sabi Wanderer 104039620 collection",
  "status": "active",
  "branch": "chore/annotate-104039620",
  "objective": "Annotate every current and newly updated work by Pixiv creator 104039620, review each result, record and fix general issues, then rebuild and overwrite the Google Drive author collection.",
  "github": {
    "issue": 185,
    "pull_request": null
  },
  "scope": {
    "in": [
      "tasks/translation/data/pixiv/104039620 source inventory and current translation artifacts",
      "per-work annotation jobs, TSV candidates, refs-annotate, and rendered study files",
      ".agents/skills/annotate and translation pipeline fixes proven necessary by real-work dogfood",
      "agent/tasks/gh-185-annotate-104039620 execution state and GitHub issue #185 progress records",
      "錆流浪 author collection build, Google Drive overwrite, and post-publish verification"
    ],
    "out": [
      "unrelated authors and non-translation subprojects",
      "broad workspace migration tracked by #155",
      "semantic multi-model ranking that is not required to finish the collection",
      "publishing private source excerpts or adult text in public GitHub comments"
    ]
  },
  "context_files": [
    {
      "path": "docs/PROJECT_STATUS.md",
      "purpose": "Current project phase and priorities",
      "required": true
    },
    {
      "path": ".agents/skills/annotate/SKILL.md",
      "purpose": "Per-work annotation executor and acceptance contract",
      "required": true
    },
    {
      "path": ".agents/skills/annotate/references/annotation-guide.md",
      "purpose": "Annotation density, reading, meaning, and grammar quality guidance",
      "required": true
    },
    {
      "path": "tasks/translation/docs/system-design.md",
      "purpose": "Artifact, candidate, version, ref, and study-rendering architecture",
      "required": true
    },
    {
      "path": "tasks/translation/README.md",
      "purpose": "Supported Make entrypoints for source sync, annotation, and publishing",
      "required": true
    }
  ],
  "decisions": [
    {
      "id": "D1",
      "summary": "Run one work through the complete annotate loop before starting the next.",
      "reason": "The user wants each real result reviewed so general problems are fixed before they spread across the collection.",
      "status": "active"
    },
    {
      "id": "D2",
      "summary": "Record routine per-work evidence on #185; open a separate issue and PR only for generalizable skill or pipeline changes.",
      "reason": "This keeps GitHub readable while preserving one-issue-one-change review discipline.",
      "status": "active"
    },
    {
      "id": "D3",
      "summary": "Do not publish source excerpts in GitHub records.",
      "reason": "The repository is public and the source works can contain adult/private reading material; segment IDs and neutral minimal examples are sufficient.",
      "status": "active"
    }
  ],
  "open_questions": [],
  "blockers": [],
  "plan": [
    {
      "id": "S1",
      "title": "Sync and inventory creator 104039620",
      "status": "completed",
      "depends_on": [],
      "acceptance": [
        "Pixiv download/update entrypoint has been run for creator 104039620.",
        "Every current source work is listed with source revision, translation ref, annotation ref, and study status.",
        "The existing Google Drive destination and prior managed collection files are identified without modifying them."
      ]
    },
    {
      "id": "S2",
      "title": "Complete the per-work annotate and quality-review loop",
      "status": "in_progress",
      "depends_on": ["S1"],
      "acceptance": [
        "Each work has a candidate bound to the current source revision.",
        "Each finish has zero unresolved segments and creates a current annotation ref plus study output.",
        "Each work passes replay idempotence and a human sample review recorded on #185.",
        "Generalizable defects are tracked and fixed through separate issues and PRs before continuing."
      ]
    },
    {
      "id": "S3",
      "title": "Reconcile source updates and complete final coverage",
      "status": "pending",
      "depends_on": ["S2"],
      "acceptance": [
        "A final Pixiv sync finds no unprocessed new or revised work.",
        "All translation and annotation refs match their current source revisions.",
        "All study outputs render without unresolved segments."
      ]
    },
    {
      "id": "S4",
      "title": "Build and overwrite the Google Drive author collection",
      "status": "pending",
      "depends_on": ["S3"],
      "acceptance": [
        "The author collection includes the intended study artifacts for every current work.",
        "The mounted Google Drive destination is overwritten using the repository Make entrypoint.",
        "Local and Drive manifests/files/digests match and obsolete managed collection files are absent."
      ]
    },
    {
      "id": "S5",
      "title": "Close the campaign with reproducible evidence",
      "status": "pending",
      "depends_on": ["S4"],
      "acceptance": [
        "Issue #185 contains final work counts, validation results, publish path, and any follow-up issues.",
        "Required repository validation passes.",
        "Task state and final checkpoint are complete and reviewable."
      ]
    }
  ],
  "next_action": {
    "step_id": "S2",
    "instruction": "Run the complete annotate skill loop for the next shortest unannotated work, pixiv 27659699, then review and record its quality before selecting another work.",
    "acceptance": [
      "27659699 publishes with zero unresolved segments and a current annotation ref plus study output.",
      "Repeated finish adds no attestation/version and leaves the ref unchanged.",
      "A beginning/middle/end sample review and any generalizable finding are recorded on #185."
    ]
  },
  "validation": {
    "required_commands": [
      "make agent-validate",
      "conda run -n llm python -m pytest tasks/translation/src -q",
      "make docs-drift",
      "git diff --check"
    ],
    "last_results": [
      {
        "command": "make pixiv-download USER_ID=104039620 ARGS=...",
        "status": "passed",
        "summary": "Pixiv sync found 25 current works: written=0, skipped=25, failed=0.",
        "timestamp": "2026-07-18T08:16:02Z"
      },
      {
        "command": "make translate-user MODE=verify ... (25 per-work workspaces)",
        "status": "passed",
        "summary": "All 25 translation refs match current source revisions and rendered outputs match refs.",
        "timestamp": "2026-07-18T08:16:02Z"
      },
      {
        "command": "make author-collection-verify CREATOR=104039620 PROVIDER=pixiv",
        "status": "passed",
        "summary": "Existing 25-document zh/bilingual EPUB collection is internally consistent and matches the two Google Drive files by SHA-256.",
        "timestamp": "2026-07-18T08:16:02Z"
      },
      {
        "command": "make annotate MODE=finish/status PROVIDER=pixiv WS=...pixiv-25977608",
        "status": "passed",
        "summary": "25977608 published 265/265 segments with zero unresolved; replay added zero attestations and versions and kept the ref digest stable.",
        "timestamp": "2026-07-18T08:16:02Z"
      }
    ]
  },
  "known_unrelated_changes": [],
  "last_checkpoint": {
    "checkpoint_id": "cp-20260718T081602Z-codex",
    "timestamp": "2026-07-18T08:16:02Z",
    "agent": "codex",
    "summary": "Completed the current-author inventory and the 25977608 annotate, quality-review, and idempotence loop.",
    "observed_head": "f973ee3ce0a36a74e878e82a971e93ea78bde551"
  },
  "next_task": null
}
